copy,arguments
"¿Cocinar y limpiar? ¡Con Mabe, solo cocinar! Nuestras estufas con recubrimiento cerámico se limpian en un santiamén. Más tiempo para ti, menos para fregar. #MabeFacilita","Destaca la facilidad de limpieza y ahorro de tiempo, atractivo para jóvenes ocupados."
"Navidad sin estrés: Cocina, disfruta y olvídate de la limpieza. Estufas Mabe con cerámica fácil de limpiar. Porque la fiesta continúa después de la cena. #NavidadMabe",Conecta con la temporada navideña y el deseo de disfrutar sin preocupaciones.
"Manchas rebeldes, ¿dónde? Estufas Mabe con cerámica mágica. Cocina sin miedo, limpia sin esfuerzo. Tu aliado culinario desde 1920. #MabeMagia","Usa un tono divertido y mágico, apelando a la historia de la marca y la innovación."
"¡Ups, se derramó la salsa! No pasa nada, con las estufas Mabe de cerámica fácil de limpiar. Cocina con pasión, limpia con diversión. #MabeNoStress","Aborda un problema común de forma ligera, mostrando la solución de Mabe."
"Cenar, bailar, limpiar la estufa en un segundo y seguir la fiesta. Todo es posible con Mabe. Estufas con cerámica que se limpian más rápido que tus stories. #MabeRapidez","Compara la rapidez de limpieza con algo familiar para los jóvenes, como las redes sociales."
"Tu estufa Mabe: El único testigo de tus experimentos culinarios que no te delatará. Cerámica fácil de limpiar, para chefs en entrenamiento. #MabeSecretos",Usa humor para conectar con jóvenes que están aprendiendo a cocinar.
"Navidad 2024: Año nuevo, estufa nueva. Mabe con cerámica fácil de limpiar. Porque los propósitos de limpieza sí se cumplen con nosotros. #MabeAñoNuevo",Vincula el producto con los propósitos de año nuevo de forma humorística.
"¿Quién dijo que cocinar era aburrido? Estufas Mabe: Fáciles de usar, más fáciles de limpiar. Tu compañera para aventuras culinarias desde 1920. #MabeAventura","Presenta la cocina como una aventura emocionante, apelando al espíritu joven."
"Estufa Mabe: El único electrodoméstico que te hace quedar bien con tu mamá y con tus amigos. Fácil de usar, más fácil de limpiar. #MabeParaTodos",Apela tanto a la aprobación familiar como a la vida social de los jóvenes.
La fiesta sigue en la cocina con Mabe. Estufas con cerámica fácil de limpiar. Porque la diversión no termina cuando empieza la limpieza. #MabeFiesta,Asocia la cocina y la limpieza con conceptos divertidos y festivos.
